name,price
A Light in the ...,441.64
Tipping the Velvet,458.45
Soumission,427.40
Sharp Objects,407.95
Sapiens: A Brief History ...,462.63
The Requiem Red,193.22
The Dirty Little Secrets ...,284.42
The Coming Woman: A ...,152.96
The Boys in the ...,192.80
The Black Maria,444.89
Starving Hearts (Triangular Trade ...,119.35
Shakespeare's Sonnets,176.25
Set Me Free,148.95
Scott Pilgrim's Precious Little ...,446.08
Rip it Up and ...,298.75
Our Band Could Be ...,488.39
Olio,203.72
Mesaerion: The Best Science ...,320.68
Libertarianism for Beginners,437.89
It's Only the Himalayas,385.34
In Her Wake,109.54
How Music Works,318.37
Foolproof Preserving: A Guide ...,260.36
Chase Me (Paris Nights ...,215.58
Black Dust,294.57
Birdsong: A Story in ...,466.13
America's Cradle of Quarterbacks: ...,191.95
Aladdin and His Wonderful ...,453.25
Worlds Elsewhere: Journeys Around ...,343.80
Wall and Piece,376.90
The Four Agreements: A ...,150.66
The Five Love Languages: ...,264.88
The Elephant Tree,203.21
The Bear and the ...,314.70
Sophie's World,135.98
Penny Maybe,283.99
Maude (1883-1993):She Grew Up ...,153.73
"In a Dark, Dark ...",167.46
Behind Closed Doors,445.48
You can't bury them ...,286.89
Slow States of Collapse: ...,488.91
Reasons to Stay Alive,225.30
Private Paris (Private #10),406.16
#HigherSelfie: Wake Up Your ...,197.15
Without Borders (Wanderlove #1),384.49
When We Collided,271.03
"We Love You, Charlie ...",428.85
Untitled Collection: Sabbath Poems ...,121.74
Unseen City: The Majesty ...,376.90
Unicorn Tracks,160.21
Unbound: How Eight Technologies ...,217.71
Tsubasa: WoRLD CHRoNiCLE 2 ...,138.88
Throwing Rocks at the ...,265.48
This One Summer,166.27
Thirst,147.33
The Torch Is Passed: ...,162.85
The Secret of Dreadwillow ...,478.84
The Pioneer Woman Cooks: ...,481.23
The Past Never Ends,482.00
The Natural History of ...,385.77
The Nameless City (The ...,325.54
The Murder That Never ...,461.61
The Most Perfect Thing: ...,366.49
The Mindfulness and Acceptance ...,203.80
The Life-Changing Magic of ...,143.06
The Inefficiency Assassin: Time ...,175.65
The Gutsy Girl: Escapades ...,316.75
The Electric Pencil: Drawings ...,478.24
The Death of Humanity: ...,495.73
The Bulletproof Diet: Lose ...,418.44
The Art Forger,347.72
The Age of Genius: ...,168.31
The Activist's Tao Te ...,275.04
Spark Joy: An Illustrated ...,356.85
Soul Reader,337.65
Security,334.84
"Saga, Volume 6 (Saga ...",213.44
"Saga, Volume 5 (Saga ...",435.42
Reskilling America: Learning to ...,169.17
"Rat Queens, Vol. 3: ...",429.96
"Princess Jellyfish 2-in-1 Omnibus, ...",116.11
Princess Between Worlds (Wide-Awake ...,113.80
"Pop Gun War, Volume ...",161.83
"Political Suicide: Missteps, Peccadilloes, ...",309.50
Patience,86.67
"Outcast, Vol. 1: A ...",131.72
orange: The Complete Collection ...,412.98
Online Marketing for Busy ...,395.41
On a Midnight Clear,120.03
Obsidian (Lux #1),126.77
My Paris Kitchen: Recipes ...,284.68
Masks and Shadows,481.14
Mama Tried: Traditional Italian ...,119.60
"Lumberjanes, Vol. 2: Friendship ...",400.18
"Lumberjanes, Vol. 1: Beware ...",389.09
Lumberjanes Vol. 3: A ...,169.94
"Layered: Baking, Building, and ...",342.17
Judo: Seven Steps to ...,459.82
Join,304.30
In the Country We ...,187.68
Immunity: How Elie Metchnikoff ...,489.33
"I Hate Fairyland, Vol. ...",248.85
I am a Hero ...,466.04
How to Be Miserable: ...,392.68
Her Backup Boyfriend (The ...,289.79
"Giant Days, Vol. 2 ...",188.62
Forever and Forever: The ...,253.28
First and First (Five ...,136.24
Fifty Shades Darker (Fifty ...,187.34
Everydata: The Misinformation Hidden ...,463.65
Don't Be a Jerk: ...,323.92
Danganronpa Volume 1,443.52
Crown of Midnight (Throne ...,369.30
"Codename Baboushka, Volume 1: ...",313.25
Camp Midnight,145.71
Call the Nurse: True ...,248.59
Burning,245.78
Bossypants,421.94
"Bitch Planet, Vol. 1: ...",323.49
Avatar: The Last Airbender: ...,239.63
Algorithms to Live By: ...,262.84
A World of Flavor: ...,366.40
"A Piece of Sky, ...",484.21
A Murder in Time,141.95
A Flight of Arrows ...,473.72
A Fierce and Subtle ...,239.97
A Court of Thorns ...,446.76
(Un)Qualified: How God Uses ...,460.67
You Are What You ...,186.57
William Shakespeare's Star Wars: ...,369.39
Tuesday Nights in 1980,179.49
Tracing Numbers on a ...,354.89
Throne of Glass (Throne ...,299.18
Thomas Jefferson and the ...,508.78
Thirteen Reasons Why,449.75
The White Cat and ...,495.47
The Wedding Dress,205.77
The Vacationers,359.58
The Third Wave: An ...,107.57
The Stranger,148.78
The Shadow Hero (The ...,282.71
The Secret (The Secret ...,233.49
The Regional Office Is ...,438.15
The Psychopath Test: A ...,307.11
The Project,90.85
The Power of Now: ...,371.44
The Omnivore's Dilemma: A ...,325.97
The Nerdy Nummies Cookbook: ...,318.54
The Murder of Roger ...,376.21
The Mistake (Off-Campus #2),369.30
The Matchmaker's Playbook (Wingmen ...,476.45
The Love and Lemons ...,320.76
The Long Shadow of ...,93.58
The Kite Runner,356.76
The House by the ...,315.22
The Glittering Court (The ...,377.75
The Girl on the ...,469.37
The Genius of Birds,147.07
The Emerald Mystery,197.49
The Cookies & Cups ...,351.90
The Bridge to Consciousness: ...,272.99
The Artist's Way: A ...,328.35
The Art of War,284.42
The Argonauts,93.24
The 10% Entrepreneur: Live ...,235.03
Suddenly in Love (Lake ...,477.65
Something More Than This,138.54
Soft Apocalypse,222.83
So You've Been Publicly ...,104.33
Shoe Dog: A Memoir ...,204.66
"Shobu Samurai, Project Aryoku ...",247.91
Secrets and Lace (Fatal ...,172.92
Scarlett Epstein Hates It ...,371.52
Romero and Juliet: A ...,315.13
Redeeming Love,174.63
Poses for Artists Volume ...,350.28
Poems That Make Grown ...,121.05
"Nightingale, Sing",326.56
Night Sky with Exit ...,350.19
Mrs. Houdini,258.06
Modern Romance,241.08
Miss Peregrine’s Home for ...,91.79
Louisa: The Extraordinary Life ...,143.75
Little Red,114.91
Library of Souls (Miss ...,414.26
Large Print Heart of ...,163.37
I Had a Nice ...,489.33
Hollow City (Miss Peregrine’s ...,366.66
Grumbles,189.04
Full Moon over Noah’s ...,421.68
Frostbite (Vampire Academy #2),255.84
Follow You Home,182.22
First Steps for New ...,247.40
Finders Keepers (Bill Hodges ...,456.66
"Fables, Vol. 1: Legends ...",355.06
Eureka Trivia 6.0,465.70
Drive: The Surprising Truth ...,298.15
Done Rubbed Out (Reightman ...,321.79
Doing It Over (Most ...,303.79
Deliciously Ella Every Day: ...,359.66
Dark Notes,163.71
Daring Greatly: How the ...,165.76
Close to You,421.94
Chasing Heaven: What Dying ...,322.47
Big Magic: Creative Living ...,262.75
Becoming Wise: An Inquiry ...,234.00
Beauty Restored (Riley Family ...,94.78
Batman: The Long Halloween ...,311.38
Batman: The Dark Knight ...,131.21
Ayumi's Violin,132.06
Anonymous,399.42
Amy Meets the Saints ...,157.48
Amid the Chaos,312.06
Amatus,431.15
Agnostic: A Spirited Manifesto,106.72
Zealot: The Life and ...,210.71
You (You #1),372.03
"Wonder Woman: Earth One, ...",318.54
Wild Swans,122.50
Why the Right Went ...,449.15
Whole Lotta Creativity Going ...,325.88
What's It Like in ...,167.21
"We Are Robin, Vol. ...",459.82
Walt Disney's Alice in ...,110.56
V for Vendetta (V ...,316.50
Until Friday Night (The ...,395.07
Unbroken: A World War ...,391.99
Twenty Yawns,188.36
Through the Woods,216.51
This Is Where It ...,231.36
The Year of Magical ...,367.17
The Wright Brothers,484.56
The White Queen (The ...,221.04
The Wedding Pact (The ...,278.19
The Time Keeper,237.84
The Testament of Mary,449.32
The Star-Touched Queen,392.59
The Songs of the ...,379.45
The Song of Achilles,319.06
The Rosie Project (Don ...,461.01
The Power of Habit: ...,144.00
The Marriage of Opposites,239.55
The Lucifer Effect: Understanding ...,88.72
The Long Haul (Diary ...,375.96
The Loney,199.62
The Literature Book (Big ...,148.69
The Last Mile (Amos ...,462.46
The Immortal Life of ...,346.95
The Hidden Oracle (The ...,445.82
The Help Yourself Cookbook ...,245.43
The Guilty (Will Robie ...,117.90
The First Hostage (J.B. ...,220.52
The Dovekeepers,416.14
The Darkest Lie,301.57
The Bane Chronicles (The ...,381.59
The Bad-Ass Librarians of ...,134.53
The 14th Colony (Cotton ...,334.75
That Darkness (Gardiner and ...,118.75
Tastes Like Fear (DI ...,91.20
Take Me with You,385.68
Swell: A Year of ...,388.84
Superman Vol. 1: Before ...,101.43
Still Life with Bread ...,225.30
Steve Jobs,336.97
Sorting the Beef from ...,381.67
Someone Like You (The ...,450.35
"So Cute It Hurts!!, ...",302.25
Shtum,476.37
See America: A Celebration ...,416.91
salt.,399.08
Robin War,407.95
"Red Hood/Arsenal, Vol. 1: ...",217.37
Rain Fish,201.07
Quarter Life Poetry: Poems ...,434.14
Pet Sematary,90.09
"Overload: How to Unplug, ...",444.89
Once Was a Time,155.94
Old School (Diary of ...,100.92
No Dream Is Too ...,187.25
"Naruto (3-in-1 Edition), Vol. ...",327.50
My Name Is Lucy ...,354.54
My Mrs. Brown,208.84
My Kind of Crazy,344.31
Mr. Mercedes (Bill Hodges ...,246.54
More Than Music (Chasing ...,320.85
Made to Stick: Why ...,331.43
Luis Paints the World,460.24
Luckiest Girl Alive,425.09
Lowriders to the Center ...,439.43
Love Is a Mix ...,153.81
Looking for Lovely: Collecting ...,248.59
Living Leadership by Insight: ...,400.18
Let It Out: A ...,228.54
Lady Midnight (The Dark ...,138.88
"It's All Easy: Healthy, ...",166.78
Island of Dragons (Unwanteds ...,252.94
I Know What I'm ...,221.63
I Am Pilgrim (Pilgrim ...,90.43
Hyperbole and a Half: ...,125.83
"Hush, Hush (Hush, Hush ...",401.12
Hold Your Breath (Search ...,245.86
Hamilton: The Revolution,501.53
Greek Mythic History,87.27
God: The Most Unpleasant ...,256.18
Glory over Everything: Beyond ...,391.06
Feathers: Displays of Brilliant ...,418.44
Far & Away: Places ...,128.48
Every Last Word,396.43
Eligible (The Austen Project ...,231.10
El Deafo,491.55
Eight Hundred Grapes,122.76
Eaternity: More than 150 ...,441.47
"Eat Fat, Get Thin",461.27
Don't Get Caught,472.19
Doctor Sleep (The Shining ...,342.26
Demigods & Magicians: Percy ...,319.99
Dear Mr. Knightley,95.63
Daily Fantasy Sports,312.06
Crazy Love: Overwhelmed by ...,407.09
Cometh the Hour (The ...,213.36
Code Name Verity (Code ...,188.79
Clockwork Angel (The Infernal ...,376.55
City of Glass (The ...,477.90
City of Fallen Angels ...,95.80
City of Bones (The ...,369.22
City of Ashes (The ...,403.26
Cell,173.09
Catching Jordan (Hundred Oaks),433.63
"Carry On, Warrior: Thoughts ...",271.71
Carrie,394.38
Buying In: The Secret ...,322.47
Brain on Fire: My ...,420.74
Batman: Europa,273.07
Barefoot Contessa Back to ...,238.95
Barefoot Contessa at Home: ...,431.83
Balloon Animals,145.28
Art Ops Vol. 1,416.31
Aristotle and Dante Discover ...,495.99
Angels Walking (Angels Walking ...,291.76
Angels & Demons (Robert ...,439.17
All the Light We ...,254.82
Adulthood Is a Myth: ...,92.99
Abstract City,480.89
A Time of Torment ...,412.47
A Study in Scarlet ...,142.72
A Series of Catastrophes ...,481.83
A People's History of ...,347.98
A Man Called Ove,338.85
A Distant Mirror: The ...,124.38
A Brush of Wings ...,473.55
1491: New Revelations of ...,185.97
"The Three Searches, Meaning, ...",113.72
Searching for Meaning in ...,330.40
Rook,322.98
My Kitchen Year: 136 ...,98.36
13 Hours: The Inside ...,230.85
Will You Won't You ...,118.24
Tipping Point for Planet ...,320.34
The Silent Sister (Riley ...,394.90
The Midnight Watch: A ...,223.51
The Lonely City: Adventures ...,283.74
The Gray Rhino: How ...,504.60
The Golden Condom: And ...,336.37
The Epidemic (The Program ...,123.19
The Dinner Party,482.34
The Diary of a ...,511.00
The Children,101.35
Stars Above (The Lunar ...,409.91
Snatched: How A Drug ...,180.94
Raspberry Pi Electronics Projects ...,423.73
Quench Your Own Thirst: ...,368.02
Psycho: Sanitarium (Psycho #1.5),315.39
Poisonous (Max Revere Novels ...,228.63
One with You (Crossfire ...,134.02
No Love Allowed (Dodge ...,466.21
Murder at the 42nd ...,463.74
Most Wanted,300.97
"Love, Lies and Spies",175.31
How to Speak Golf: ...,497.52
Hide Away (Eve Duncan ...,101.01
Furiously Happy: A Funny ...,353.69
Everyday Italian: 125 Simple ...,171.47
Equal Is Unfair: America's ...,485.07
Eleanor & Park,482.08
Dirty (Dive Bar #1),348.32
Can You Keep a ...,414.94
Boar Island (Anna Pigeon ...,507.42
A Paris Apartment,332.79
A la Mode: 120 ...,330.74
Troublemaker: Surviving Hollywood and ...,412.81
The Widow,232.55
The Sleep Revolution: Transforming ...,99.64
The Improbability of Love,507.16
The Art of Startup ...,179.15
Take Me Home Tonight ...,460.50
Sleeping Giants (Themis Files ...,415.80
Setting the World on ...,180.43
Playing with Fire,116.96
Off the Hook (Fishing ...,406.67
Mothering Sunday,113.80
"Mother, Can You Not?",144.09
M Train,231.87
Lilac Girls,147.41
Lies and Other Acts ...,385.08
Lab Girl,348.49
Keep Me Posted,174.54
It Didn't Start with ...,480.03
Grey (Fifty Shades #4),413.66
"Exit, Pursued by a ...",437.98
Daredevils,139.39
Cravings: Recipes for What ...,174.88
Born for This: How ...,184.18
Arena,182.22
Adultery,178.13
A Mother's Reckoning: Living ...,166.61
A Gentleman's Position (Society ...,125.83
11/22/63,413.58
10% Happier: How I ...,209.60
10-Day Green Smoothie Cleanse: ...,424.07
Without Shame,411.79
Watchmen,495.22
Unlimited Intuition Now,502.21
Underlying Notes,100.84
The Shack,239.12
The New Brand You: ...,375.79
The Moosewood Cookbook: Recipes ...,105.27
The Flowers Lied,142.30
The Fabric of the ...,476.96
The Book of Mormon,209.60
The Art and Science ...,451.97
The Alien Club,464.08
Suzie Snowflake: One beautiful ...,467.58
Nap-a-Roo,213.95
NaNo What Now? Finding ...,88.81
Modern Day Fables,404.71
If I Gave You ...,178.38
"Fruits Basket, Vol. 9 ...",289.62
Dress Your Family in ...,372.63
Don't Forget Steven,283.48
Chernobyl 01:23:40: The Incredible ...,306.43
Art and Fear: Observations ...,414.86
A Shard of Ice ...,483.10
A Hero's Curse (The ...,430.73
23 Degrees South: A ...,305.32
Zero to One: Notes ...,290.56
Why Not Me?,151.51
When Breath Becomes Air,335.78
Vagabonding: An Uncommon Guide ...,315.13
The Unlikely Pilgrimage of ...,372.12
The New Drawing on ...,367.00
"The Midnight Assassin: Panic, ...",242.70
The Martian (The Martian ...,353.09
The High Mountains of ...,436.36
The Grownup,306.09
The E-Myth Revisited: Why ...,314.88
South of Sunshine,246.80
Smarter Faster Better: The ...,331.77
Silence in the Dark ...,497.61
Shadows of the Past ...,338.42
Roller Girl,120.29
Rising Strong,186.14
Proofs of God: Classical ...,462.46
Please Kill Me: The ...,266.08
Out of Print: City ...,457.60
My Life Next Door ...,310.44
Miller's Valley,499.40
Man's Search for Meaning,251.49
Love That Boy: What ...,213.78
Living Forward: A Proven ...,107.06
Les Fleurs du Mal,247.74
Left Behind (Left Behind ...,347.38
Kill 'Em and Leave: ...,384.32
Kierkegaard: A Christian Missionary ...,402.06
John Vassos: Industrial Design ...,172.49
I'll Give You the ...,481.83
I Will Find You,377.15
Hystopia: A Novel,187.34
Howl and Other Poems,345.07
History of Beauty,87.78
Heaven is for Real: ...,450.94
Future Shock (Future Shock ...,474.74
Ender's Game (The Ender ...,372.29
Diary of a Citizen ...,242.36
Death by Leisure: A ...,319.99
Brilliant Beacons: A History ...,97.68
Brazen: The Courage to ...,163.96
Between the World and ...,485.49
Being Mortal: Medicine and ...,469.71
A Murder Over a ...,112.61
32 Yolks,457.51
"""Most Blessed of the ...",379.45
You Are a Badass: ...,103.05
Wildlife of New York: ...,188.87
What Happened on Beale ...,216.43
Unreasonable Hope: Finding Faith ...,395.24
Under the Tuscan Sun,318.46
Toddlers Are A**holes: It's ...,217.96
The Year of Living ...,296.19
The Whale,306.77
The Story of Art,350.96
The Origin of Species,85.39
The Great Gatsby,307.54
The Good Girl,418.27
The Glass Castle,138.54
The Faith of Christopher ...,337.40
The Drowning Girls,304.30
The Constant Princess (The ...,141.78
The Bourne Identity (Jason ...,364.95
The Bachelor Girl's Guide ...,446.17
The Art Book,275.89
The 7 Habits of ...,282.97
Team of Rivals: The ...,171.64
Steal Like an Artist: ...,178.30
"Sit, Stay, Love",178.30
Sister Dear,342.94
"Shrunken Treasures: Literary Classics, ...",451.03
"Rich Dad, Poor Dad",441.39
Raymie Nightingale,293.55
Playing from the Heart,276.23
Nightstruck: A Novel,429.53
Naturally Lean: 125 Nourishing ...,97.08
Meternity,371.78
Memoirs of a Geisha,423.73
Like Never Before (Walker ...,245.43
Life of Pi,112.78
Leave This Song Behind: ...,436.53
King's Folly (The Kinsman ...,337.91
John Adams,489.93
How to Cook Everything ...,392.51
How to Be a ...,241.00
Good in Bed (Cannie ...,316.07
"Fruits Basket, Vol. 7 ...",166.95
For the Love: Fighting ...,385.00
Finding God in the ...,397.88
Every Heart a Doorway ...,103.74
Delivering the Truth (Quaker ...,178.21
Counted With the Stars ...,153.30
"Chronicles, Vol. 1",448.73
Blue Like Jazz: Nonreligious ...,219.84
Benjamin Franklin: An American ...,411.10
At The Existentialist Café: ...,255.33
A Summer In Europe,378.26
A Short History of ...,447.02
A Gathering of Shadows ...,382.27
The Sound Of Love,493.43
The Rise and Fall ...,338.42
The Perks of Being ...,469.37
The Mysterious Affair at ...,211.57
The Man Who Mistook ...,507.16
The Makings of a ...,269.41
The Joy of Cooking,369.13
The Invention of Wings,318.54
The Hobbit (Middle-Earth Universe),151.85
The Great Railway Bazaar,260.53
The Golden Compass (His ...,160.12
The God Delusion,399.67
The Girl You Left ...,134.70
The Fellowship of the ...,87.61
The Collected Poems of ...,131.55
The Barefoot Contessa Cookbook,511.17
Tell the Wolves I'm ...,434.73
Ship Leaves Harbor: Essays ...,261.05
Pride and Prejudice,164.39
Musicophilia: Tales of Music ...,397.37
Mere Christianity,413.83
Me Before You (Me ...,162.26
In the Woods (Dublin ...,327.42
In Cold Blood,426.37
How to Stop Worrying ...,396.60
Give It Back,156.29
"Girl, Interrupted",359.49
Fun Home: A Family ...,482.76
"Fruits Basket, Vol. 6 ...",178.81
Deception Point,343.97
"Death Note, Vol. 6: ...",310.44
Catherine the Great: Portrait ...,499.48
Better Homes and Gardens ...,337.91
An Unquiet Mind: A ...,181.71
A Year in Provence ...,485.24
World Without End (The ...,281.26
"Will Grayson, Will Grayson ...",403.60
Why Save the Bankers?: ...,415.20
Where She Went (If ...,355.99
What If?: Serious Scientific ...,457.94
Two Summers,124.89
This Is Your Brain ...,327.59
The Secret Garden,128.65
The Raven King (The ...,260.79
The Raven Boys (The ...,492.57
The Power Greens Cookbook: ...,94.27
The Metamorphosis,243.81
The Mathews Men: Seven ...,366.06
The Little Paris Bookshop,210.97
The Hiding Place,476.96
The Grand Design,117.39
The Firm,388.67
The Fault in Our ...,402.83
The False Prince (The ...,477.73
The Expatriates,380.31
The Dream Thieves (The ...,294.32
The Darkest Corners,96.66
The Crossover,330.74
The 5th Wave (The ...,100.92
Tell the Wind and ...,388.24
Tell Me Three Things,356.68
Talking to Girls About ...,214.55
Siddhartha,291.93
Shiver (The Wolves of ...,138.46
Remember Me?,97.93
Red Dragon (Hannibal Lecter ...,199.37
Peak: Secrets from the ...,138.88
My Mother Was Nuts,269.83
Mexican Today: New and ...,212.50
Maybe Something Beautiful: How ...,192.29
Lola and the Boy ...,201.59
Logan Kade (Fallen Crest ...,111.93
Last One Home (New ...,511.68
Killing Floor (Jack Reacher ...,268.64
Kill the Boy Band,132.40
Isla and the Happily ...,410.59
If I Stay (If ...,325.28
I Know Why the ...,311.80
Harry Potter and the ...,198.94
"Fruits Basket, Vol. 5 ...",139.31
Foundation (Foundation (Publication Order) ...,276.57
Fool Me Once,144.68
Find Her (Detective D.D. ...,190.84
Evicted: Poverty and Profit ...,360.60
Drama,330.15
Dracula the Un-Dead,303.96
Digital Fortress,494.79
"Death Note, Vol. 5: ...",447.10
"Data, A Love Story: ...",275.97
Critique of Pure Reason,177.02
Booked,149.21
"Blue Lily, Lily Blue ...",291.16
Approval Junkie: Adventures in ...,501.70
An Abundance of Katherines,85.31
America's War for the ...,436.95
Alight (The Generations Trilogy ...,499.83
A Girl's Guide to ...,267.02
A Game of Thrones ...,396.00
A Feast for Crows ...,146.82
A Clash of Kings ...,92.05
Vogue Colors A to ...,446.59
The Shining (The Shining ...,237.84
The Pilgrim's Progress,428.76
The Perfect Play (Play ...,511.77
The Passion of Dolssa,241.60
The Jazz of Physics: ...,330.23
The Hunger Games (The ...,254.65
The Hound of the ...,126.43
The Gunning of America: ...,143.40
The Geography of Bliss: ...,240.83
The Demonists (Demonist #1),444.55
The Demon Prince of ...,237.84
The Bone Hunters (Lexy ...,509.38
The Beast (Black Dagger ...,393.10
Some Women,117.13
Shopaholic Ties the Knot ...,412.81
Paper and Fire (The ...,421.85
Outlander (Outlander #1),167.80
Orchestra of Exiles: The ...,105.44
No One Here Gets ...,170.79
Night Shift (Night Shift ...,108.77
Needful Things,405.30
Mockingjay (The Hunger Games ...,174.37
Misery,296.79
Little Women (Little Women ...,239.46
It,213.36
Gone with the Wind,277.17
God Is Not Great: ...,237.16
Girl With a Pearl ...,228.37
"Fruits Basket, Vol. 4 ...",430.30
Far From True (Promise ...,297.98
Dark Lover (Black Dagger ...,109.79
Confessions of a Shopaholic ...,417.50
Changing the Game (Play ...,114.14
Candide,500.17
Atlas Shrugged,226.75
Animal Farm,488.14
A Walk to Remember,481.40
A New Earth: Awakening ...,474.74
A History of God: ...,235.62
'Salem's Lot,422.79
Zero History (Blue Ant ...,296.62
Wuthering Heights,151.25
World War Z: An ...,185.97
Wild: From Lost to ...,392.59
"Where'd You Go, Bernadette",154.67
When You Are Engulfed ...,263.52
We the People: The ...,272.56
We Are All Completely ...,205.08
Walk the Edge (Thunder ...,276.06
Voyager (Outlander #3),179.75
Very Good Lives: The ...,432.18
Vegan Vegetarian Omnivore: Dinner ...,116.53
"Unstuffed: Decluttering Your Home, ...",495.56
Under the Banner of ...,255.93
Two Boys Kissing,279.30
Twilight (Twilight #1),357.70
Twenties Girl,365.12
Trespassing Across America: One ...,456.49
Three-Martini Lunch,198.00
"Thinking, Fast and Slow",180.34
The Wild Robot,478.33
The Wicked + The ...,122.93
The Undomestic Goddess,390.29
The Travelers,134.53
The Tipping Point: How ...,85.48
The Thing About Jellyfish,416.05
The Stand,493.60
The Smitten Kitchen Cookbook,201.24
The Silkworm (Cormoran Strike ...,196.64
"The Sandman, Vol. 3: ...",473.89
The Rose & the ...,500.25
The Road to Little ...,198.00
The Rise of Theodore ...,363.16
The Restaurant at the ...,93.16
The Rest Is Noise: ...,296.62
The Red Tent,304.21
The Purpose Driven Life: ...,317.26
The Purest Hook (Second ...,104.50
The Picture of Dorian ...,253.37
The Paris Wife,313.94
The Obsession,387.56
The Nightingale,224.02
The New Guy (and ...,383.21
The Nanny Diaries (Nanny ...,448.13
The Name of God ...,317.78
The Maze Runner (The ...,178.55
The Lover's Dictionary,495.56
The Lonely Ones,371.86
The Lean Startup: How ...,289.37
The Last Painting of ...,473.89
"The Land of 10,000 ...",252.86
The Infinities,233.83
The Husband's Secret,447.96
The Hitchhiker's Guide to ...,407.78
The Guns of August,124.04
The Guernsey Literary and ...,422.54
The Goldfinch,371.78
The Giver (The Giver ...,104.93
The Girl with All ...,422.02
The Girl Who Played ...,188.87
The Girl Who Kicked ...,490.36
The Exiled,370.67
The End of Faith: ...,188.79
"The Elegant Universe: Superstrings, ...",111.16
The Disappearing Spoon: And ...,489.25
The Devil Wears Prada ...,377.83
The Demon-Haunted World: Science ...,445.74
The Day the Crayons ...,224.62
The Da Vinci Code ...,195.87
The Cuckoo's Calling (Cormoran ...,163.88
The Complete Stories and ...,228.46
The Complete Poems,352.50
The Catcher in the ...,209.43
The Cat in the ...,138.71
The Case for Christ ...,408.12
The Book Thief,456.32
The Book of Basketball: ...,382.53
The Blind Side: Evolution ...,458.19
The Autobiography of Malcolm ...,199.88
The Art of Simple ...,292.78
The Art of Fielding,188.53
"Surely You're Joking, Mr. ...",220.35
Stiff: The Curious Lives ...,313.43
Spilled Milk: Based on ...,422.36
Something Borrowed (Darcy & ...,417.67
Something Blue (Darcy & ...,465.96
Soldier (Talon #3),210.88
Shopaholic & Baby (Shopaholic ...,396.26
Seven Days in the ...,446.42
Seven Brief Lessons on ...,261.05
Scarlet (The Lunar Chronicles ...,124.30
Sarah's Key,394.90
"Saga, Volume 3 (Saga ...",184.01
Running with Scissors,110.13
Rogue Lawyer (Rogue Lawyer ...,427.48
Rise of the Rocket ...,355.48
Rework,382.87
Reservations for Two,94.69
Red: The True Story ...,243.47
Ready Player One,162.68
Quiet: The Power of ...,371.52
Prodigy: The Graphic Novel ...,372.20
Persepolis: The Story of ...,333.81
